event_id,name,college_name,techfest_name,city,category,subcategory,event_type,min_team_size,max_team_size,team_possible,price,prize_pool,start_date,end_date,duration_days,description,tags,rating,popularity,college_rating,college_category,registration_link,contact_email,coordinates
454,Structural Design @ Axis,VNIT Nagpur,Axis,Nagpur,Civil,Structural Design,Team,3,3,True,546,10000,2026-10-02,2026-10-04,2,👥 Team event - Form your dream team and compete together!,"Civil, Structural Design, Premier Institute, Axis, team-event",4.5,4.8,4.7,Premier Institute,https://axisvnit.org/events/454,events@axisvnit.org,"21.1458° N, 79.0882° E"
455,Aeromodelling @ Turbine,TCET Mumbai,Turbine,Mumbai,Mechanical,Aeromodelling,Solo,1,1,False,897,50000,2026-05-12,2026-05-13,1,Join us for Aeromodelling at TCET Mumbai's Turbine! This mechanical event challenges participants to showcase their expertise in mechanical domain.,"Mechanical, Aeromodelling, Other Notable, Turbine, solo-event",3.6,3.8,3.8,Other Notable,https://tcetmumbai.in/turbine/events/455,events@tcetmumbai.in/turbine,"19.0760° N, 72.8777° E"
456,Structural Design @ Pillai Techfest,Pillai Panvel,Pillai Techfest,Panvel,Civil,Structural Design,Both,1,4,True,1020,10000,2026-09-27,2026-09-29,2,💡 Structural Design at Pillai Techfest - Pillai Panvel. Compete in this civil event and win exciting prizes! Open for all engineering students.,"Civil, Structural Design, Other Notable, Pillai Techfest, team-event",3.9,3.9,3.7,Other Notable,https://pillai.edu.in/techfest/events/456,events@pillai.edu.in/techfest,"18.9920° N, 73.1120° E"
457,Business Plan @ Impulse,SPIT Mumbai,Impulse,Mumbai,Management,Business Plan,Team,2,4,True,913,10000,2026-05-31,2026-06-01,1,🚀 SPIT Mumbai invites you to participate in Business Plan during Impulse. A perfect platform for management enthusiasts to demonstrate their talents.,"Management, Business Plan, Highly Reputed, Impulse, team-event",4.5,4.7,4.4,Highly Reputed,https://spitimpulse.in/events/457,events@spitimpulse.in,"19.0760° N, 72.8777° E"
458,Cloud Computing @ Techyon,WCE Sangli,Techyon,Sangli,Workshop,Cloud Computing,Team,2,3,True,2685,0,2026-08-30,2026-09-02,3,🎯 WCE Sangli presents Cloud Computing - an exciting workshop event at Techyon! Test your skills and compete with the best minds from across Maharashtra.,"Workshop, Cloud Computing, Highly Reputed, Techyon, team-event",4.3,4.2,4.3,Highly Reputed,https://techyon.wce.ac.in/events/458,events@techyon.wce.ac.in,"16.8637° N, 74.5696° E"
459,Treasure Hunt @ Symbiosis Techfest,SIT Pune,Symbiosis Techfest,Pune,Competition,Treasure Hunt,Solo,1,1,False,176,2000,2026-10-09,2026-10-12,3,Join us for Treasure Hunt at SIT Pune's Symbiosis Techfest! This competition event challenges participants to showcase their expertise in competition domain.,"Competition, Treasure Hunt, Highly Reputed, Symbiosis Techfest, solo-event",4.3,4.4,4.1,Highly Reputed,https://sitpune.edu.in/techfest/events/459,events@sitpune.edu.in/techfest,"18.5204° N, 73.8567° E"
460,Drone Racing @ RSCOE Techfest,RSCOE Pune,RSCOE Techfest,Pune,Robotics,Drone Racing,Team,2,3,True,825,10000,2026-08-22,2026-08-24,2,💡 Drone Racing at RSCOE Techfest - RSCOE Pune. Compete in this robotics event and win exciting prizes! Open for all engineering students.,"Robotics, Drone Racing, Other Notable, RSCOE Techfest, team-event",3.9,3.7,3.8,Other Notable,https://rscoe.edu.in/techfest/events/460,events@rscoe.edu.in/techfest,"18.5204° N, 73.8567° E"
461,Poster Making @ Expedition,PICT Pune,Expedition,Pune,Design,Poster Making,Team,3,3,True,332,10000,2026-09-17,2026-09-18,1,💡 Poster Making at Expedition - PICT Pune. Compete in this design event and win exciting prizes! Open for all engineering students.,"Design, Poster Making, Highly Reputed, Expedition, team-event",4.6,4.6,4.4,Highly Reputed,https://expedition.pict.edu/events/461,events@expedition.pict.edu,"18.5204° N, 73.8567° E"
462,Project Presentation @ Pinnacle,PCCOE Pune,Pinnacle,Pune,Technical Paper,Project Presentation,Solo,1,1,False,280,1000,2026-08-23,2026-08-24,1,🚀 PCCOE Pune invites you to participate in Project Presentation during Pinnacle. A perfect platform for technical paper enthusiasts to demonstrate their talents.,"Technical Paper, Project Presentation, Notable, Pinnacle, solo-event",4.3,4.1,4.0,Notable,https://pccoepune.edu.in/pinnacle/events/462,events@pccoepune.edu.in/pinnacle,"18.5204° N, 73.8567° E"
463,CAD Design @ Technotron,GCOE Aurangabad,Technotron,Aurangabad,Mechanical,CAD Design,Solo,1,1,False,2045,10000,2026-08-06,2026-08-08,2,Join us for CAD Design at GCOE Aurangabad's Technotron! This mechanical event challenges participants to showcase their expertise in mechanical domain.,"Mechanical, CAD Design, Notable, Technotron, solo-event",4.1,3.7,3.8,Notable,https://gcoea.ac.in/technotron/events/463,events@gcoea.ac.in/technotron,"19.8762° N, 75.3433° E"
464,Line Follower @ Momentum,ICT Mumbai,Momentum,Mumbai,Robotics,Line Follower,Both,1,3,True,464,5000,2026-05-31,2026-06-03,3,💡 Line Follower at Momentum - ICT Mumbai. Compete in this robotics event and win exciting prizes! Open for all engineering students.,"Robotics, Line Follower, Premier Institute, Momentum, team-event",4.3,4.6,4.6,Premier Institute,https://momentum.ictmumbai.edu.in/events/464,events@momentum.ictmumbai.edu.in,"19.0760° N, 72.8777° E"
465,CAD Design @ Technovanza,VJTI Mumbai,Technovanza,Mumbai,Mechanical,CAD Design,Team,2,3,True,1537,5000,2026-05-21,2026-05-24,3,💡 CAD Design at Technovanza - VJTI Mumbai. Compete in this mechanical event and win exciting prizes! Open for all engineering students.,"Mechanical, CAD Design, Premier Institute, Technovanza, team-event",4.7,4.7,4.5,Premier Institute,https://technovanza.org/events/465,events@technovanza.org,"19.0760° N, 72.8777° E"
466,Treasure Hunt @ Symbiosis Techfest,SIT Pune,Symbiosis Techfest,Pune,Competition,Treasure Hunt,Solo,1,1,False,269,2000,2026-09-17,2026-09-20,3,🎯 SIT Pune presents Treasure Hunt - an exciting competition event at Symbiosis Techfest! Test your skills and compete with the best minds from across Maharashtra.,"Competition, Treasure Hunt, Highly Reputed, Symbiosis Techfest, solo-event",4.1,4.0,4.1,Highly Reputed,https://sitpune.edu.in/techfest/events/466,events@sitpune.edu.in/techfest,"18.5204° N, 73.8567° E"
467,Water Management @ PVG Techfest,PVGCOET Pune,PVG Techfest,Pune,Civil,Water Management,Team,3,5,True,1106,20000,2026-08-06,2026-08-08,2,👥 Team event - Form your dream team and compete together!,"Civil, Water Management, Other Notable, PVG Techfest, team-event",3.9,3.9,3.7,Other Notable,https://pvgcoet.ac.in/techfest/events/467,events@pvgcoet.ac.in/techfest,"18.5204° N, 73.8567° E"
468,Innovation Challenge @ SGGSTech,SGGSIE&T Nanded,SGGSTech,Nanded,Technical Paper,Innovation Challenge,Both,1,2,True,113,1000,2026-05-19,2026-05-21,2,🤝 Open for both solo and team participation!,"Technical Paper, Innovation Challenge, Other Notable, SGGSTech, team-event",3.6,4.0,3.8,Other Notable,https://sggs.ac.in/techfest/events/468,events@sggs.ac.in/techfest,"19.1383° N, 77.3210° E"
469,Poster Making @ VESITech,VESIT Mumbai,VESITech,Mumbai,Design,Poster Making,Team,3,3,True,448,3000,2026-06-15,2026-06-16,1,🎯 VESIT Mumbai presents Poster Making - an exciting design event at VESITech! Test your skills and compete with the best minds from across Maharashtra.,"Design, Poster Making, Notable, VESITech, team-event",4.2,4.0,3.9,Notable,https://vesit.edu.in/techfest/events/469,events@vesit.edu.in/techfest,"19.0760° N, 72.8777° E"
470,Bot Battle @ Raitram,RAIT Navi Mumbai,Raitram,Navi Mumbai,Robotics,Bot Battle,Both,1,3,True,291,50000,2026-10-09,2026-10-10,1,🎯 RAIT Navi Mumbai presents Bot Battle - an exciting robotics event at Raitram! Test your skills and compete with the best minds from across Maharashtra.,"Robotics, Bot Battle, Other Notable, Raitram, team-event",3.6,3.6,3.7,Other Notable,https://rait.edu.in/raitram/events/470,events@rait.edu.in/raitram,"19.0330° N, 73.0297° E"
471,Go Kart Racing @ Pinnacle,PCCOE Pune,Pinnacle,Pune,Mechanical,Go Kart Racing,Solo,1,1,False,2320,5000,2026-06-22,2026-06-25,3,🎯 PCCOE Pune presents Go Kart Racing - an exciting mechanical event at Pinnacle! Test your skills and compete with the best minds from across Maharashtra.,"Mechanical, Go Kart Racing, Notable, Pinnacle, solo-event",3.8,4.4,4.0,Notable,https://pccoepune.edu.in/pinnacle/events/471,events@pccoepune.edu.in/pinnacle,"18.5204° N, 73.8567° E"
472,Hackathon @ Cognizance,IIIT Pune,Cognizance,Pune,Coding,Hackathon,Solo,1,1,False,243,10000,2026-05-31,2026-06-01,1,🚀 IIIT Pune invites you to participate in Hackathon during Cognizance. A perfect platform for coding enthusiasts to demonstrate their talents.,"Coding, Hackathon, Highly Reputed, Cognizance, solo-event",4.6,4.5,4.4,Highly Reputed,https://cognizance.org.in/events/472,events@cognizance.org.in,"18.5204° N, 73.8567° E"
473,Code Debugging @ Prerana,SPCE Mumbai,Prerana,Mumbai,Coding,Code Debugging,Team,2,4,True,175,10000,2026-09-08,2026-09-09,1,Join us for Code Debugging at SPCE Mumbai's Prerana! This coding event challenges participants to showcase their expertise in coding domain.,"Coding, Code Debugging, Notable, Prerana, team-event",3.9,3.8,4.0,Notable,https://spce.ac.in/prerana/events/473,events@spce.ac.in/prerana,"19.0760° N, 72.8777° E"
474,Logo Design @ SGGSTech,SGGSIE&T Nanded,SGGSTech,Nanded,Design,Logo Design,Team,2,4,True,294,10000,2026-09-27,2026-09-30,3,🚀 SGGSIE&T Nanded invites you to participate in Logo Design during SGGSTech. A perfect platform for design enthusiasts to demonstrate their talents.,"Design, Logo Design, Other Notable, SGGSTech, team-event",3.6,3.9,3.8,Other Notable,https://sggs.ac.in/techfest/events/474,events@sggs.ac.in/techfest,"19.1383° N, 77.3210° E"
475,Case Study @ RSCOE Techfest,RSCOE Pune,RSCOE Techfest,Pune,Management,Case Study,Solo,1,1,False,181,5000,2026-05-07,2026-05-10,3,Join us for Case Study at RSCOE Pune's RSCOE Techfest! This management event challenges participants to showcase their expertise in management domain.,"Management, Case Study, Other Notable, RSCOE Techfest, solo-event",3.7,3.8,3.8,Other Notable,https://rscoe.edu.in/techfest/events/475,events@rscoe.edu.in/techfest,"18.5204° N, 73.8567° E"
476,Innovation Challenge @ Manthan,MPSTME Mumbai,Manthan,Mumbai,Technical Paper,Innovation Challenge,Solo,1,1,False,90,10000,2026-05-02,2026-05-05,3,🚀 MPSTME Mumbai invites you to participate in Innovation Challenge during Manthan. A perfect platform for technical paper enthusiasts to demonstrate their talents.,"Technical Paper, Innovation Challenge, Notable, Manthan, solo-event",3.7,4.0,4.0,Notable,https://mpstme.edu.in/manthan/events/476,events@mpstme.edu.in/manthan,"19.0760° N, 72.8777° E"
477,UI/UX Challenge @ Raisoni Techfest,Raisoni Nagpur,Raisoni Techfest,Nagpur,Design,UI/UX Challenge,Team,3,5,True,199,5000,2026-07-09,2026-07-12,3,Join us for UI/UX Challenge at Raisoni Nagpur's Raisoni Techfest! This design event challenges participants to showcase their expertise in design domain.,"Design, UI/UX Challenge, Notable, Raisoni Techfest, team-event",4.2,4.1,3.9,Notable,https://raisoni.net/techfest/events/477,events@raisoni.net/techfest,"21.1458° N, 79.0882° E"
478,Robo Race @ Impulse,SPIT Mumbai,Impulse,Mumbai,Robotics,Robo Race,Team,2,2,True,366,20000,2026-05-12,2026-05-15,3,🎯 SPIT Mumbai presents Robo Race - an exciting robotics event at Impulse! Test your skills and compete with the best minds from across Maharashtra.,"Robotics, Robo Race, Highly Reputed, Impulse, team-event",4.3,4.3,4.4,Highly Reputed,https://spitimpulse.in/events/478,events@spitimpulse.in,"19.0760° N, 72.8777° E"
479,Line Follower @ Expedition,PICT Pune,Expedition,Pune,Robotics,Line Follower,Both,1,3,True,318,20000,2026-06-14,2026-06-15,1,🤝 Open for both solo and team participation!,"Robotics, Line Follower, Highly Reputed, Expedition, team-event",4.6,4.5,4.4,Highly Reputed,https://expedition.pict.edu/events/479,events@expedition.pict.edu,"18.5204° N, 73.8567° E"
480,Innovation Challenge @ Techyon,WCE Sangli,Techyon,Sangli,Technical Paper,Innovation Challenge,Solo,1,1,False,170,1000,2026-06-04,2026-06-06,2,🎯 WCE Sangli presents Innovation Challenge - an exciting technical paper event at Techyon! Test your skills and compete with the best minds from across Maharashtra.,"Technical Paper, Innovation Challenge, Highly Reputed, Techyon, solo-event",4.6,4.3,4.3,Highly Reputed,https://techyon.wce.ac.in/events/480,events@techyon.wce.ac.in,"16.8637° N, 74.5696° E"
481,UI/UX Challenge @ Momentum,ICT Mumbai,Momentum,Mumbai,Design,UI/UX Challenge,Team,3,5,True,117,5000,2026-09-02,2026-09-04,2,Join us for UI/UX Challenge at ICT Mumbai's Momentum! This design event challenges participants to showcase their expertise in design domain.,"Design, UI/UX Challenge, Premier Institute, Momentum, team-event",4.6,4.6,4.6,Premier Institute,https://momentum.ictmumbai.edu.in/events/481,events@momentum.ictmumbai.edu.in,"19.0760° N, 72.8777° E"
482,IoT Workshop @ Symbiosis Techfest,SIT Pune,Symbiosis Techfest,Pune,Electronics,IoT Workshop,Solo,1,1,False,1742,30000,2026-05-03,2026-05-06,3,Join us for IoT Workshop at SIT Pune's Symbiosis Techfest! This electronics event challenges participants to showcase their expertise in electronics domain.,"Electronics, IoT Workshop, Highly Reputed, Symbiosis Techfest, solo-event",4.4,4.3,4.1,Highly Reputed,https://sitpune.edu.in/techfest/events/482,events@sitpune.edu.in/techfest,"18.5204° N, 73.8567° E"
483,3D Modeling @ Bharati Techfest,BVUCOE Pune,Bharati Techfest,Pune,Design,3D Modeling,Team,2,2,True,463,5000,2026-05-28,2026-05-30,2,🎯 BVUCOE Pune presents 3D Modeling - an exciting design event at Bharati Techfest! Test your skills and compete with the best minds from across Maharashtra.,"Design, 3D Modeling, Notable, Bharati Techfest, team-event",4.0,4.1,3.9,Notable,https://bvucoepune.edu.in/techfest/events/483,events@bvucoepune.edu.in/techfest,"18.5204° N, 73.8567° E"
484,Robotics Workshop @ Vihaan,VIT Pune,Vihaan,Pune,Workshop,Robotics Workshop,Solo,1,1,False,2909,0,2026-06-26,2026-06-29,3,Join us for Robotics Workshop at VIT Pune's Vihaan! This workshop event challenges participants to showcase their expertise in workshop domain.,"Workshop, Robotics Workshop, Highly Reputed, Vihaan, solo-event",4.3,4.4,4.2,Highly Reputed,https://vihaan.vit.edu/events/484,events@vihaan.vit.edu,"18.5204° N, 73.8567° E"
485,Marketing Challenge @ Bharati Techfest,BVUCOE Pune,Bharati Techfest,Pune,Management,Marketing Challenge,Team,2,2,True,837,2000,2026-08-18,2026-08-21,3,🎯 BVUCOE Pune presents Marketing Challenge - an exciting management event at Bharati Techfest! Test your skills and compete with the best minds from across Maharashtra.,"Management, Marketing Challenge, Notable, Bharati Techfest, team-event",4.0,4.2,3.9,Notable,https://bvucoepune.edu.in/techfest/events/485,events@bvucoepune.edu.in/techfest,"18.5204° N, 73.8567° E"
486,Technical Writing @ Bharati Techfest,BVUCOE Pune,Bharati Techfest,Pune,Technical Paper,Technical Writing,Team,2,2,True,193,5000,2026-08-17,2026-08-18,1,🎯 BVUCOE Pune presents Technical Writing - an exciting technical paper event at Bharati Techfest! Test your skills and compete with the best minds from across Maharashtra.,"Technical Paper, Technical Writing, Notable, Bharati Techfest, team-event",3.7,3.9,3.9,Notable,https://bvucoepune.edu.in/techfest/events/486,events@bvucoepune.edu.in/techfest,"18.5204° N, 73.8567° E"
487,Hackathon @ MITE,MIT-WPU Pune,MITE,Pune,Coding,Hackathon,Both,1,2,True,250,25000,2026-05-19,2026-05-21,2,🤝 Open for both solo and team participation!,"Coding, Hackathon, Highly Reputed, MITE, team-event",4.0,4.3,4.2,Highly Reputed,https://mite.mitwpu.edu.in/events/487,events@mite.mitwpu.edu.in,"18.5204° N, 73.8567° E"
488,Finance Quiz @ Axis,VNIT Nagpur,Axis,Nagpur,Management,Finance Quiz,Solo,1,1,False,373,5000,2026-04-30,2026-05-03,3,💡 Finance Quiz at Axis - VNIT Nagpur. Compete in this management event and win exciting prizes! Open for all engineering students.,"Management, Finance Quiz, Premier Institute, Axis, solo-event",4.6,4.7,4.7,Premier Institute,https://axisvnit.org/events/488,events@axisvnit.org,"21.1458° N, 79.0882° E"
489,CAD Design @ Sanskruti,KJ Somaiya Mumbai,Sanskruti,Mumbai,Mechanical,CAD Design,Team,2,3,True,1382,50000,2026-10-08,2026-10-09,1,Join us for CAD Design at KJ Somaiya Mumbai's Sanskruti! This mechanical event challenges participants to showcase their expertise in mechanical domain.,"Mechanical, CAD Design, Highly Reputed, Sanskruti, team-event",4.3,4.6,4.3,Highly Reputed,https://sanskruti.somaiya.edu/events/489,events@sanskruti.somaiya.edu,"19.0760° N, 72.8777° E"
490,PCB Design @ Technovanza,VJTI Mumbai,Technovanza,Mumbai,Electronics,PCB Design,Team,3,4,True,438,4000,2026-09-26,2026-09-27,1,💡 PCB Design at Technovanza - VJTI Mumbai. Compete in this electronics event and win exciting prizes! Open for all engineering students.,"Electronics, PCB Design, Premier Institute, Technovanza, team-event",4.4,4.9,4.5,Premier Institute,https://technovanza.org/events/490,events@technovanza.org,"19.0760° N, 72.8777° E"
491,Algorithm Challenge @ Pillai Techfest,Pillai Panvel,Pillai Techfest,Panvel,Coding,Algorithm Challenge,Both,1,3,True,333,3000,2026-08-22,2026-08-25,3,💡 Algorithm Challenge at Pillai Techfest - Pillai Panvel. Compete in this coding event and win exciting prizes! Open for all engineering students.,"Coding, Algorithm Challenge, Other Notable, Pillai Techfest, team-event",3.5,4.1,3.7,Other Notable,https://pillai.edu.in/techfest/events/491,events@pillai.edu.in/techfest,"18.9920° N, 73.1120° E"
492,Technical Writing @ Cumminspark,Cummins Pune,Cumminspark,Pune,Technical Paper,Technical Writing,Solo,1,1,False,63,2000,2026-08-31,2026-09-03,3,🎯 Cummins Pune presents Technical Writing - an exciting technical paper event at Cumminspark! Test your skills and compete with the best minds from across Maharashtra.,"Technical Paper, Technical Writing, Highly Reputed, Cumminspark, solo-event",4.5,4.1,4.2,Highly Reputed,https://cumminspark.edu.in/events/492,events@cumminspark.edu.in,"18.5204° N, 73.8567° E"
493,Surveying @ Impulse,COEP Technological University,Impulse,Pune,Civil,Surveying,Team,3,5,True,909,3000,2026-05-28,2026-05-30,2,👥 Team event - Form your dream team and compete together!,"Civil, Surveying, Premier Institute, Impulse, team-event",4.6,4.4,4.5,Premier Institute,https://impulse.coep.org.in/events/493,events@impulse.coep.org.in,"18.5204° N, 73.8567° E"
494,Technical Writing @ SGGSTech,SGGSIE&T Nanded,SGGSTech,Nanded,Technical Paper,Technical Writing,Team,3,3,True,197,1000,2026-08-29,2026-08-31,2,🚀 SGGSIE&T Nanded invites you to participate in Technical Writing during SGGSTech. A perfect platform for technical paper enthusiasts to demonstrate their talents.,"Technical Paper, Technical Writing, Other Notable, SGGSTech, team-event",3.7,3.6,3.8,Other Notable,https://sggs.ac.in/techfest/events/494,events@sggs.ac.in/techfest,"19.1383° N, 77.3210° E"
495,Project Presentation @ Vihaan,VIT Pune,Vihaan,Pune,Technical Paper,Project Presentation,Both,1,4,True,98,1000,2026-08-18,2026-08-20,2,Join us for Project Presentation at VIT Pune's Vihaan! This technical paper event challenges participants to showcase their expertise in technical paper domain.,"Technical Paper, Project Presentation, Highly Reputed, Vihaan, team-event",4.0,4.4,4.2,Highly Reputed,https://vihaan.vit.edu/events/495,events@vihaan.vit.edu,"18.5204° N, 73.8567° E"
496,Group Discussion @ GHRCE Techfest,GHRCE Nagpur,GHRCE Techfest,Nagpur,Competition,Group Discussion,Solo,1,1,False,93,20000,2026-07-07,2026-07-09,2,💡 Group Discussion at GHRCE Techfest - GHRCE Nagpur. Compete in this competition event and win exciting prizes! Open for all engineering students.,"Competition, Group Discussion, Notable, GHRCE Techfest, solo-event",3.9,3.9,3.9,Notable,https://ghrce.raisoni.net/techfest/events/496,events@ghrce.raisoni.net/techfest,"21.1458° N, 79.0882° E"
497,Robotics Workshop @ Synergy,DJ Sanghvi Mumbai,Synergy,Mumbai,Workshop,Robotics Workshop,Team,3,4,True,1056,0,2026-10-03,2026-10-06,3,👥 Team event - Form your dream team and compete together!,"Workshop, Robotics Workshop, Highly Reputed, Synergy, team-event",4.2,4.5,4.3,Highly Reputed,https://synergy.djsce.ac.in/events/497,events@synergy.djsce.ac.in,"19.0760° N, 72.8777° E"
498,Poster Making @ Axis,VNIT Nagpur,Axis,Nagpur,Design,Poster Making,Team,2,3,True,492,5000,2026-06-16,2026-06-17,1,💡 Poster Making at Axis - VNIT Nagpur. Compete in this design event and win exciting prizes! Open for all engineering students.,"Design, Poster Making, Premier Institute, Axis, team-event",4.9,4.6,4.7,Premier Institute,https://axisvnit.org/events/498,events@axisvnit.org,"21.1458° N, 79.0882° E"
499,Business Plan @ Technovanza,AIT Pune,Technovanza,Pune,Management,Business Plan,Solo,1,1,False,751,20000,2026-08-23,2026-08-26,3,🎯 Solo event - Individual participation only. Showcase your personal skills in Management!,"Management, Business Plan, Highly Reputed, Technovanza, solo-event",4.3,4.3,4.1,Highly Reputed,https://aitpune.edu.in/technovanza/events/499,events@aitpune.edu.in/technovanza,"18.5204° N, 73.8567° E"
500,Project Presentation @ Pinnacle,PCCOE Pune,Pinnacle,Pune,Technical Paper,Project Presentation,Solo,1,1,False,257,5000,2026-09-19,2026-09-20,1,🎯 Solo event - Individual participation only. Showcase your personal skills in Technical Paper!,"Technical Paper, Project Presentation, Notable, Pinnacle, solo-event",3.9,4.1,4.0,Notable,https://pccoepune.edu.in/pinnacle/events/500,events@pccoepune.edu.in/pinnacle,"18.5204° N, 73.8567° E"
501,Business Plan @ Cumminspark,Cummins Pune,Cumminspark,Pune,Management,Business Plan,Both,1,2,True,362,2000,2026-10-14,2026-10-16,2,🤝 Open for both solo and team participation!,"Management, Business Plan, Highly Reputed, Cumminspark, team-event",4.1,4.5,4.2,Highly Reputed,https://cumminspark.edu.in/events/501,events@cumminspark.edu.in,"18.5204° N, 73.8567° E"
502,Group Discussion @ Axis,VNIT Nagpur,Axis,Nagpur,Competition,Group Discussion,Solo,1,1,False,184,20000,2026-09-10,2026-09-13,3,🎯 VNIT Nagpur presents Group Discussion - an exciting competition event at Axis! Test your skills and compete with the best minds from across Maharashtra.,"Competition, Group Discussion, Premier Institute, Axis, solo-event",4.5,4.5,4.7,Premier Institute,https://axisvnit.org/events/502,events@axisvnit.org,"21.1458° N, 79.0882° E"
503,Water Management @ Cognizance,IIIT Pune,Cognizance,Pune,Civil,Water Management,Both,1,3,True,1445,6000,2026-07-29,2026-08-01,3,🚀 IIIT Pune invites you to participate in Water Management during Cognizance. A perfect platform for civil enthusiasts to demonstrate their talents.,"Civil, Water Management, Highly Reputed, Cognizance, team-event",4.3,4.3,4.4,Highly Reputed,https://cognizance.org.in/events/503,events@cognizance.org.in,"18.5204° N, 73.8567° E"
504,Sustainable Design @ Prerana,SPCE Mumbai,Prerana,Mumbai,Civil,Sustainable Design,Solo,1,1,False,1027,10000,2026-09-12,2026-09-13,1,Join us for Sustainable Design at SPCE Mumbai's Prerana! This civil event challenges participants to showcase their expertise in civil domain.,"Civil, Sustainable Design, Notable, Prerana, solo-event",4.1,3.9,4.0,Notable,https://spce.ac.in/prerana/events/504,events@spce.ac.in/prerana,"19.0760° N, 72.8777° E"
505,Business Plan @ FCRIT Fest,FCRIT Navi Mumbai,FCRIT Fest,Navi Mumbai,Management,Business Plan,Team,2,4,True,418,5000,2026-07-11,2026-07-12,1,💡 Business Plan at FCRIT Fest - FCRIT Navi Mumbai. Compete in this management event and win exciting prizes! Open for all engineering students.,"Management, Business Plan, Other Notable, FCRIT Fest, team-event",3.5,4.0,3.7,Other Notable,https://fcrit.ac.in/fest/events/505,events@fcrit.ac.in/fest,"19.0330° N, 73.0297° E"
506,3D Modeling @ Manthan,MPSTME Mumbai,Manthan,Mumbai,Design,3D Modeling,Team,3,5,True,161,10000,2026-07-25,2026-07-27,2,💡 3D Modeling at Manthan - MPSTME Mumbai. Compete in this design event and win exciting prizes! Open for all engineering students.,"Design, 3D Modeling, Notable, Manthan, team-event",3.9,3.9,4.0,Notable,https://mpstme.edu.in/manthan/events/506,events@mpstme.edu.in/manthan,"19.0760° N, 72.8777° E"
507,Line Follower @ Techfest,IIT Bombay,Techfest,Mumbai,Robotics,Line Follower,Team,2,2,True,458,10000,2026-09-26,2026-09-27,1,Join us for Line Follower at IIT Bombay's Techfest! This robotics event challenges participants to showcase their expertise in robotics domain.,"Robotics, Line Follower, Premier Institute, Techfest, team-event",4.5,4.8,4.8,Premier Institute,https://techfest.org/events/507,events@techfest.org,"19.0760° N, 72.8777° E"
508,Robotics Workshop @ PVG Techfest,PVGCOET Pune,PVG Techfest,Pune,Workshop,Robotics Workshop,Both,1,4,True,733,0,2026-07-26,2026-07-28,2,💡 Robotics Workshop at PVG Techfest - PVGCOET Pune. Compete in this workshop event and win exciting prizes! Open for all engineering students.,"Workshop, Robotics Workshop, Other Notable, PVG Techfest, team-event",3.7,3.5,3.7,Other Notable,https://pvgcoet.ac.in/techfest/events/508,events@pvgcoet.ac.in/techfest,"18.5204° N, 73.8567° E"
509,Water Management @ SGGSTech,SGGSIE&T Nanded,SGGSTech,Nanded,Civil,Water Management,Solo,1,1,False,749,20000,2026-06-07,2026-06-08,1,🚀 SGGSIE&T Nanded invites you to participate in Water Management during SGGSTech. A perfect platform for civil enthusiasts to demonstrate their talents.,"Civil, Water Management, Other Notable, SGGSTech, solo-event",3.9,3.7,3.8,Other Notable,https://sggs.ac.in/techfest/events/509,events@sggs.ac.in/techfest,"19.1383° N, 77.3210° E"
