event_id,name,college_name,techfest_name,city,category,subcategory,event_type,min_team_size,max_team_size,team_possible,price,prize_pool,start_date,end_date,duration_days,description,tags,rating,popularity,college_rating,college_category,registration_link,contact_email,coordinates
734,HR Summit @ Turbine,TCET Mumbai,Turbine,Mumbai,Management,HR Summit,Solo,1,1,False,230,5000,2026-06-21,2026-06-23,2,🎯 Solo event - Individual participation only. Showcase your personal skills in Management!,"Management, HR Summit, Other Notable, Turbine, solo-event",4.0,4.0,3.8,Other Notable,https://tcetmumbai.in/turbine/events/734,events@tcetmumbai.in/turbine,"19.0760° N, 72.8777° E"
735,Robotics Workshop @ Techtors,YCCE Nagpur,Techtors,Nagpur,Workshop,Robotics Workshop,Team,2,3,True,731,0,2026-06-14,2026-06-17,3,💡 Robotics Workshop at Techtors - YCCE Nagpur. Compete in this workshop event and win exciting prizes! Open for all engineering students.,"Workshop, Robotics Workshop, Notable, Techtors, team-event",3.6,4.2,3.9,Notable,https://ycce.edu/techtors/events/735,events@ycce.edu/techtors,"21.1458° N, 79.0882° E"
736,Algorithm Challenge @ Aaghaaz,IIIT Nagpur,Aaghaaz,Nagpur,Coding,Algorithm Challenge,Both,1,2,True,90,3000,2026-07-19,2026-07-20,1,🤝 Open for both solo and team participation!,"Coding, Algorithm Challenge, Highly Reputed, Aaghaaz, team-event",4.4,4.4,4.3,Highly Reputed,https://aaghaaz.org/events/736,events@aaghaaz.org,"21.1458° N, 79.0882° E"
737,Poster Making @ T-Spectra,TSEC Mumbai,T-Spectra,Mumbai,Design,Poster Making,Team,3,4,True,285,10000,2026-06-03,2026-06-06,3,Join us for Poster Making at TSEC Mumbai's T-Spectra! This design event challenges participants to showcase their expertise in design domain.,"Design, Poster Making, Notable, T-Spectra, team-event",4.2,4.2,3.9,Notable,https://tsec.edu.in/t-spectra/events/737,events@tsec.edu.in/t-spectra,"19.0760° N, 72.8777° E"
738,Bridge Building @ SGGSTech,SGGSIE&T Nanded,SGGSTech,Nanded,Mechanical,Bridge Building,Team,2,4,True,1084,50000,2026-06-17,2026-06-18,1,👥 Team event - Form your dream team and compete together!,"Mechanical, Bridge Building, Other Notable, SGGSTech, team-event",3.8,4.1,3.8,Other Notable,https://sggs.ac.in/techfest/events/738,events@sggs.ac.in/techfest,"19.1383° N, 77.3210° E"
739,Bridge Building @ Manthan,MPSTME Mumbai,Manthan,Mumbai,Mechanical,Bridge Building,Both,1,2,True,2457,10000,2026-10-14,2026-10-16,2,🚀 MPSTME Mumbai invites you to participate in Bridge Building during Manthan. A perfect platform for mechanical enthusiasts to demonstrate their talents.,"Mechanical, Bridge Building, Notable, Manthan, team-event",3.9,4.4,4.0,Notable,https://mpstme.edu.in/manthan/events/739,events@mpstme.edu.in/manthan,"19.0760° N, 72.8777° E"
740,Hackathon @ Raitram,RAIT Navi Mumbai,Raitram,Navi Mumbai,Coding,Hackathon,Both,1,4,True,175,5000,2026-10-05,2026-10-07,2,Join us for Hackathon at RAIT Navi Mumbai's Raitram! This coding event challenges participants to showcase their expertise in coding domain.,"Coding, Hackathon, Other Notable, Raitram, team-event",3.5,4.1,3.7,Other Notable,https://rait.edu.in/raitram/events/740,events@rait.edu.in/raitram,"19.0330° N, 73.0297° E"
741,Cloud Computing @ Sanskruti,KJ Somaiya Mumbai,Sanskruti,Mumbai,Workshop,Cloud Computing,Team,3,5,True,1059,0,2026-08-20,2026-08-23,3,Join us for Cloud Computing at KJ Somaiya Mumbai's Sanskruti! This workshop event challenges participants to showcase their expertise in workshop domain.,"Workshop, Cloud Computing, Highly Reputed, Sanskruti, team-event",4.3,4.3,4.3,Highly Reputed,https://sanskruti.somaiya.edu/events/741,events@sanskruti.somaiya.edu,"19.0760° N, 72.8777° E"
742,3D Modeling @ RSCOE Techfest,RSCOE Pune,RSCOE Techfest,Pune,Design,3D Modeling,Solo,1,1,False,403,1000,2026-08-22,2026-08-24,2,🎯 Solo event - Individual participation only. Showcase your personal skills in Design!,"Design, 3D Modeling, Other Notable, RSCOE Techfest, solo-event",4.1,3.7,3.8,Other Notable,https://rscoe.edu.in/techfest/events/742,events@rscoe.edu.in/techfest,"18.5204° N, 73.8567° E"
743,Case Study @ Turbine,TCET Mumbai,Turbine,Mumbai,Management,Case Study,Team,2,2,True,811,20000,2026-05-01,2026-05-02,1,Join us for Case Study at TCET Mumbai's Turbine! This management event challenges participants to showcase their expertise in management domain.,"Management, Case Study, Other Notable, Turbine, team-event",4.0,3.7,3.8,Other Notable,https://tcetmumbai.in/turbine/events/743,events@tcetmumbai.in/turbine,"19.0760° N, 72.8777° E"
744,Algorithm Challenge @ FCRIT Fest,FCRIT Navi Mumbai,FCRIT Fest,Navi Mumbai,Coding,Algorithm Challenge,Team,2,2,True,351,25000,2026-10-19,2026-10-22,3,🚀 FCRIT Navi Mumbai invites you to participate in Algorithm Challenge during FCRIT Fest. A perfect platform for coding enthusiasts to demonstrate their talents.,"Coding, Algorithm Challenge, Other Notable, FCRIT Fest, team-event",4.0,3.9,3.7,Other Notable,https://fcrit.ac.in/fest/events/744,events@fcrit.ac.in/fest,"19.0330° N, 73.0297° E"
745,Pick and Place Robot @ Techfest,IIT Bombay,Techfest,Mumbai,Robotics,Pick and Place Robot,Solo,1,1,False,215,50000,2026-06-30,2026-07-02,2,🚀 IIT Bombay invites you to participate in Pick and Place Robot during Techfest. A perfect platform for robotics enthusiasts to demonstrate their talents.,"Robotics, Pick and Place Robot, Premier Institute, Techfest, solo-event",4.9,5.0,4.8,Premier Institute,https://techfest.org/events/745,events@techfest.org,"19.0760° N, 72.8777° E"
746,Finance Quiz @ Vishwaraj,VIIT Pune,Vishwaraj,Pune,Management,Finance Quiz,Both,1,3,True,816,2000,2026-09-17,2026-09-20,3,🤝 Open for both solo and team participation!,"Management, Finance Quiz, Notable, Vishwaraj, team-event",3.7,4.0,3.9,Notable,https://viitpune.edu.in/vishwaraj/events/746,events@viitpune.edu.in/vishwaraj,"18.5204° N, 73.8567° E"
747,Cloud Computing @ GHRCE Techfest,GHRCE Nagpur,GHRCE Techfest,Nagpur,Workshop,Cloud Computing,Team,3,3,True,2369,0,2026-10-15,2026-10-18,3,👥 Team event - Form your dream team and compete together!,"Workshop, Cloud Computing, Notable, GHRCE Techfest, team-event",4.0,4.0,3.9,Notable,https://ghrce.raisoni.net/techfest/events/747,events@ghrce.raisoni.net/techfest,"21.1458° N, 79.0882° E"
748,Group Discussion @ Pinnacle,PCCOE Pune,Pinnacle,Pune,Competition,Group Discussion,Both,1,2,True,90,20000,2026-09-14,2026-09-15,1,🎯 PCCOE Pune presents Group Discussion - an exciting competition event at Pinnacle! Test your skills and compete with the best minds from across Maharashtra.,"Competition, Group Discussion, Notable, Pinnacle, team-event",4.0,4.2,4.0,Notable,https://pccoepune.edu.in/pinnacle/events/748,events@pccoepune.edu.in/pinnacle,"18.5204° N, 73.8567° E"
749,Web Dev Battle @ Aaghaaz,IIIT Nagpur,Aaghaaz,Nagpur,Coding,Web Dev Battle,Solo,1,1,False,311,3000,2026-10-02,2026-10-03,1,🎯 Solo event - Individual participation only. Showcase your personal skills in Coding!,"Coding, Web Dev Battle, Highly Reputed, Aaghaaz, solo-event",4.5,4.4,4.3,Highly Reputed,https://aaghaaz.org/events/749,events@aaghaaz.org,"21.1458° N, 79.0882° E"
750,Poster Making @ Pillai Techfest,Pillai Panvel,Pillai Techfest,Panvel,Design,Poster Making,Team,3,4,True,221,3000,2026-05-28,2026-05-30,2,🚀 Pillai Panvel invites you to participate in Poster Making during Pillai Techfest. A perfect platform for design enthusiasts to demonstrate their talents.,"Design, Poster Making, Other Notable, Pillai Techfest, team-event",3.8,3.9,3.7,Other Notable,https://pillai.edu.in/techfest/events/750,events@pillai.edu.in/techfest,"18.9920° N, 73.1120° E"
751,Logo Design @ Technovanza,VJTI Mumbai,Technovanza,Mumbai,Design,Logo Design,Team,3,3,True,482,10000,2026-05-19,2026-05-22,3,👥 Team event - Form your dream team and compete together!,"Design, Logo Design, Premier Institute, Technovanza, team-event",4.2,4.8,4.5,Premier Institute,https://technovanza.org/events/751,events@technovanza.org,"19.0760° N, 72.8777° E"
752,Group Discussion @ VESITech,VESIT Mumbai,VESITech,Mumbai,Competition,Group Discussion,Team,3,5,True,178,5000,2026-09-11,2026-09-12,1,🎯 VESIT Mumbai presents Group Discussion - an exciting competition event at VESITech! Test your skills and compete with the best minds from across Maharashtra.,"Competition, Group Discussion, Notable, VESITech, team-event",3.6,4.0,3.9,Notable,https://vesit.edu.in/techfest/events/752,events@vesit.edu.in/techfest,"19.0760° N, 72.8777° E"
753,CAD Design @ T-Spectra,TSEC Mumbai,T-Spectra,Mumbai,Mechanical,CAD Design,Team,2,3,True,1954,5000,2026-09-24,2026-09-26,2,Join us for CAD Design at TSEC Mumbai's T-Spectra! This mechanical event challenges participants to showcase their expertise in mechanical domain.,"Mechanical, CAD Design, Notable, T-Spectra, team-event",4.1,4.1,3.9,Notable,https://tsec.edu.in/t-spectra/events/753,events@tsec.edu.in/t-spectra,"19.0760° N, 72.8777° E"
754,IoT Workshop @ Bharati Techfest,BVUCOE Pune,Bharati Techfest,Pune,Workshop,IoT Workshop,Solo,1,1,False,2948,0,2026-05-31,2026-06-03,3,Join us for IoT Workshop at BVUCOE Pune's Bharati Techfest! This workshop event challenges participants to showcase their expertise in workshop domain.,"Workshop, IoT Workshop, Notable, Bharati Techfest, solo-event",4.0,4.1,3.9,Notable,https://bvucoepune.edu.in/techfest/events/754,events@bvucoepune.edu.in/techfest,"18.5204° N, 73.8567° E"
755,Poster Making @ Raisoni Techfest,Raisoni Nagpur,Raisoni Techfest,Nagpur,Design,Poster Making,Team,2,2,True,43,3000,2026-08-20,2026-08-23,3,👥 Team event - Form your dream team and compete together!,"Design, Poster Making, Notable, Raisoni Techfest, team-event",3.9,4.1,3.9,Notable,https://raisoni.net/techfest/events/755,events@raisoni.net/techfest,"21.1458° N, 79.0882° E"
756,Project Presentation @ SGGSTech,SGGSIE&T Nanded,SGGSTech,Nanded,Technical Paper,Project Presentation,Solo,1,1,False,229,1000,2026-05-09,2026-05-10,1,🎯 SGGSIE&T Nanded presents Project Presentation - an exciting technical paper event at SGGSTech! Test your skills and compete with the best minds from across Maharashtra.,"Technical Paper, Project Presentation, Other Notable, SGGSTech, solo-event",3.7,4.0,3.8,Other Notable,https://sggs.ac.in/techfest/events/756,events@sggs.ac.in/techfest,"19.1383° N, 77.3210° E"
757,Pick and Place Robot @ SFIT Techfest,SFIT Mumbai,SFIT Techfest,Mumbai,Robotics,Pick and Place Robot,Solo,1,1,False,544,5000,2026-06-23,2026-06-24,1,🎯 SFIT Mumbai presents Pick and Place Robot - an exciting robotics event at SFIT Techfest! Test your skills and compete with the best minds from across Maharashtra.,"Robotics, Pick and Place Robot, Other Notable, SFIT Techfest, solo-event",3.6,3.6,3.8,Other Notable,https://sfit.ac.in/techfest/events/757,events@sfit.ac.in/techfest,"19.0760° N, 72.8777° E"
758,Code Debugging @ Technovanza,AIT Pune,Technovanza,Pune,Coding,Code Debugging,Both,1,4,True,453,10000,2026-07-07,2026-07-09,2,💡 Code Debugging at Technovanza - AIT Pune. Compete in this coding event and win exciting prizes! Open for all engineering students.,"Coding, Code Debugging, Highly Reputed, Technovanza, team-event",4.4,4.4,4.1,Highly Reputed,https://aitpune.edu.in/technovanza/events/758,events@aitpune.edu.in/technovanza,"18.5204° N, 73.8567° E"
759,3D Modeling @ Raisoni Techfest,Raisoni Nagpur,Raisoni Techfest,Nagpur,Design,3D Modeling,Both,1,4,True,328,5000,2026-05-18,2026-05-19,1,💡 3D Modeling at Raisoni Techfest - Raisoni Nagpur. Compete in this design event and win exciting prizes! Open for all engineering students.,"Design, 3D Modeling, Notable, Raisoni Techfest, team-event",3.9,4.3,3.9,Notable,https://raisoni.net/techfest/events/759,events@raisoni.net/techfest,"21.1458° N, 79.0882° E"
760,Technical Writing @ Technovanza,VJTI Mumbai,Technovanza,Mumbai,Technical Paper,Technical Writing,Both,1,2,True,9,2000,2026-10-11,2026-10-12,1,🎯 VJTI Mumbai presents Technical Writing - an exciting technical paper event at Technovanza! Test your skills and compete with the best minds from across Maharashtra.,"Technical Paper, Technical Writing, Premier Institute, Technovanza, team-event",4.3,4.8,4.5,Premier Institute,https://technovanza.org/events/760,events@technovanza.org,"19.0760° N, 72.8777° E"
761,AI Challenge @ Raisoni Techfest,Raisoni Nagpur,Raisoni Techfest,Nagpur,Coding,AI Challenge,Team,2,2,True,19,25000,2026-07-05,2026-07-06,1,💡 AI Challenge at Raisoni Techfest - Raisoni Nagpur. Compete in this coding event and win exciting prizes! Open for all engineering students.,"Coding, AI Challenge, Notable, Raisoni Techfest, team-event",3.9,3.9,3.9,Notable,https://raisoni.net/techfest/events/761,events@raisoni.net/techfest,"21.1458° N, 79.0882° E"
762,Debate @ SFIT Techfest,SFIT Mumbai,SFIT Techfest,Mumbai,Competition,Debate,Solo,1,1,False,145,20000,2026-07-08,2026-07-10,2,💡 Debate at SFIT Techfest - SFIT Mumbai. Compete in this competition event and win exciting prizes! Open for all engineering students.,"Competition, Debate, Other Notable, SFIT Techfest, solo-event",3.9,3.7,3.8,Other Notable,https://sfit.ac.in/techfest/events/762,events@sfit.ac.in/techfest,"19.0760° N, 72.8777° E"
763,Logo Design @ Impulse,COEP Technological University,Impulse,Pune,Design,Logo Design,Solo,1,1,False,468,1000,2026-06-03,2026-06-06,3,🎯 COEP Technological University presents Logo Design - an exciting design event at Impulse! Test your skills and compete with the best minds from across Maharashtra.,"Design, Logo Design, Premier Institute, Impulse, solo-event",4.8,4.8,4.5,Premier Institute,https://impulse.coep.org.in/events/763,events@impulse.coep.org.in,"18.5204° N, 73.8567° E"
764,3D Modeling @ Yantra,Ramdeobaba Nagpur,Yantra,Nagpur,Design,3D Modeling,Solo,1,1,False,136,1000,2026-05-06,2026-05-09,3,💡 3D Modeling at Yantra - Ramdeobaba Nagpur. Compete in this design event and win exciting prizes! Open for all engineering students.,"Design, 3D Modeling, Notable, Yantra, solo-event",4.1,4.1,4.0,Notable,https://rknpec.edu.in/yantra/events/764,events@rknpec.edu.in/yantra,"21.1458° N, 79.0882° E"
765,Debate @ Technotron,GCOE Aurangabad,Technotron,Aurangabad,Competition,Debate,Solo,1,1,False,52,2000,2026-09-19,2026-09-21,2,Join us for Debate at GCOE Aurangabad's Technotron! This competition event challenges participants to showcase their expertise in competition domain.,"Competition, Debate, Notable, Technotron, solo-event",3.6,3.7,3.8,Notable,https://gcoea.ac.in/technotron/events/765,events@gcoea.ac.in/technotron,"19.8762° N, 75.3433° E"
766,Bot Battle @ Manthan,MPSTME Mumbai,Manthan,Mumbai,Robotics,Bot Battle,Both,1,3,True,970,10000,2026-06-11,2026-06-14,3,🤝 Open for both solo and team participation!,"Robotics, Bot Battle, Notable, Manthan, team-event",4.2,4.1,4.0,Notable,https://mpstme.edu.in/manthan/events/766,events@mpstme.edu.in/manthan,"19.0760° N, 72.8777° E"
767,PCB Design @ Techfest,IIT Bombay,Techfest,Mumbai,Electronics,PCB Design,Solo,1,1,False,998,30000,2026-05-11,2026-05-14,3,Join us for PCB Design at IIT Bombay's Techfest! This electronics event challenges participants to showcase their expertise in electronics domain.,"Electronics, PCB Design, Premier Institute, Techfest, solo-event",5.0,5.0,4.8,Premier Institute,https://techfest.org/events/767,events@techfest.org,"19.0760° N, 72.8777° E"
768,Sustainable Design @ Sanskruti,KJ Somaiya Mumbai,Sanskruti,Mumbai,Civil,Sustainable Design,Team,3,5,True,285,20000,2026-08-22,2026-08-24,2,🚀 KJ Somaiya Mumbai invites you to participate in Sustainable Design during Sanskruti. A perfect platform for civil enthusiasts to demonstrate their talents.,"Civil, Sustainable Design, Highly Reputed, Sanskruti, team-event",4.3,4.7,4.3,Highly Reputed,https://sanskruti.somaiya.edu/events/768,events@sanskruti.somaiya.edu,"19.0760° N, 72.8777° E"
769,3D Modeling @ SFIT Techfest,SFIT Mumbai,SFIT Techfest,Mumbai,Design,3D Modeling,Team,3,3,True,12,10000,2026-09-15,2026-09-16,1,Join us for 3D Modeling at SFIT Mumbai's SFIT Techfest! This design event challenges participants to showcase their expertise in design domain.,"Design, 3D Modeling, Other Notable, SFIT Techfest, team-event",3.8,3.8,3.8,Other Notable,https://sfit.ac.in/techfest/events/769,events@sfit.ac.in/techfest,"19.0760° N, 72.8777° E"
770,Embedded Systems @ Axis,VNIT Nagpur,Axis,Nagpur,Electronics,Embedded Systems,Both,1,2,True,1276,8000,2026-07-18,2026-07-20,2,💡 Embedded Systems at Axis - VNIT Nagpur. Compete in this electronics event and win exciting prizes! Open for all engineering students.,"Electronics, Embedded Systems, Premier Institute, Axis, team-event",4.6,4.6,4.7,Premier Institute,https://axisvnit.org/events/770,events@axisvnit.org,"21.1458° N, 79.0882° E"
771,Robotics Workshop @ Techfest,IIT Bombay,Techfest,Mumbai,Workshop,Robotics Workshop,Team,3,5,True,2490,0,2026-09-12,2026-09-15,3,👥 Team event - Form your dream team and compete together!,"Workshop, Robotics Workshop, Premier Institute, Techfest, team-event",4.9,4.8,4.8,Premier Institute,https://techfest.org/events/771,events@techfest.org,"19.0760° N, 72.8777° E"
772,HR Summit @ SGGSTech,SGGSIE&T Nanded,SGGSTech,Nanded,Management,HR Summit,Solo,1,1,False,639,5000,2026-09-25,2026-09-26,1,🎯 SGGSIE&T Nanded presents HR Summit - an exciting management event at SGGSTech! Test your skills and compete with the best minds from across Maharashtra.,"Management, HR Summit, Other Notable, SGGSTech, solo-event",3.7,4.0,3.8,Other Notable,https://sggs.ac.in/techfest/events/772,events@sggs.ac.in/techfest,"19.1383° N, 77.3210° E"
773,Project Presentation @ MITE,MIT-WPU Pune,MITE,Pune,Technical Paper,Project Presentation,Solo,1,1,False,228,1000,2026-09-05,2026-09-08,3,💡 Project Presentation at MITE - MIT-WPU Pune. Compete in this technical paper event and win exciting prizes! Open for all engineering students.,"Technical Paper, Project Presentation, Highly Reputed, MITE, solo-event",4.1,4.4,4.2,Highly Reputed,https://mite.mitwpu.edu.in/events/773,events@mite.mitwpu.edu.in,"18.5204° N, 73.8567° E"
774,AI Challenge @ Manthan,MPSTME Mumbai,Manthan,Mumbai,Coding,AI Challenge,Solo,1,1,False,474,3000,2026-06-27,2026-06-30,3,💡 AI Challenge at Manthan - MPSTME Mumbai. Compete in this coding event and win exciting prizes! Open for all engineering students.,"Coding, AI Challenge, Notable, Manthan, solo-event",3.9,4.0,4.0,Notable,https://mpstme.edu.in/manthan/events/774,events@mpstme.edu.in/manthan,"19.0760° N, 72.8777° E"
775,Business Plan @ Techyon,WCE Sangli,Techyon,Sangli,Management,Business Plan,Solo,1,1,False,778,5000,2026-05-08,2026-05-11,3,🎯 Solo event - Individual participation only. Showcase your personal skills in Management!,"Management, Business Plan, Highly Reputed, Techyon, solo-event",4.4,4.2,4.3,Highly Reputed,https://techyon.wce.ac.in/events/775,events@techyon.wce.ac.in,"16.8637° N, 74.5696° E"
776,Model Making @ Raitram,RAIT Navi Mumbai,Raitram,Navi Mumbai,Competition,Model Making,Solo,1,1,False,61,10000,2026-07-19,2026-07-22,3,🎯 Solo event - Individual participation only. Showcase your personal skills in Competition!,"Competition, Model Making, Other Notable, Raitram, solo-event",3.6,4.1,3.7,Other Notable,https://rait.edu.in/raitram/events/776,events@rait.edu.in/raitram,"19.0330° N, 73.0297° E"
777,Photography @ Cumminspark,Cummins Pune,Cumminspark,Pune,Design,Photography,Solo,1,1,False,101,10000,2026-09-06,2026-09-09,3,Join us for Photography at Cummins Pune's Cumminspark! This design event challenges participants to showcase their expertise in design domain.,"Design, Photography, Highly Reputed, Cumminspark, solo-event",4.1,4.4,4.2,Highly Reputed,https://cumminspark.edu.in/events/777,events@cumminspark.edu.in,"18.5204° N, 73.8567° E"
778,IoT Workshop @ Cumminspark,Cummins Pune,Cumminspark,Pune,Workshop,IoT Workshop,Team,2,4,True,1252,0,2026-08-28,2026-08-30,2,💡 IoT Workshop at Cumminspark - Cummins Pune. Compete in this workshop event and win exciting prizes! Open for all engineering students.,"Workshop, IoT Workshop, Highly Reputed, Cumminspark, team-event",4.0,4.4,4.2,Highly Reputed,https://cumminspark.edu.in/events/778,events@cumminspark.edu.in,"18.5204° N, 73.8567° E"
779,IoT Workshop @ FCRIT Fest,FCRIT Navi Mumbai,FCRIT Fest,Navi Mumbai,Electronics,IoT Workshop,Solo,1,1,False,347,30000,2026-10-14,2026-10-15,1,🎯 Solo event - Individual participation only. Showcase your personal skills in Electronics!,"Electronics, IoT Workshop, Other Notable, FCRIT Fest, solo-event",3.5,4.0,3.7,Other Notable,https://fcrit.ac.in/fest/events/779,events@fcrit.ac.in/fest,"19.0330° N, 73.0297° E"
780,3D Modeling @ Bharati Techfest,BVUCOE Pune,Bharati Techfest,Pune,Design,3D Modeling,Both,1,3,True,224,5000,2026-07-24,2026-07-26,2,Join us for 3D Modeling at BVUCOE Pune's Bharati Techfest! This design event challenges participants to showcase their expertise in design domain.,"Design, 3D Modeling, Notable, Bharati Techfest, team-event",4.0,4.1,3.9,Notable,https://bvucoepune.edu.in/techfest/events/780,events@bvucoepune.edu.in/techfest,"18.5204° N, 73.8567° E"
781,Cloud Computing @ Prerana,SPCE Mumbai,Prerana,Mumbai,Workshop,Cloud Computing,Both,1,4,True,2373,0,2026-07-06,2026-07-07,1,🎯 SPCE Mumbai presents Cloud Computing - an exciting workshop event at Prerana! Test your skills and compete with the best minds from across Maharashtra.,"Workshop, Cloud Computing, Notable, Prerana, team-event",4.0,4.1,4.0,Notable,https://spce.ac.in/prerana/events/781,events@spce.ac.in/prerana,"19.0760° N, 72.8777° E"
782,Quiz @ Vihaan,VIT Pune,Vihaan,Pune,Competition,Quiz,Team,2,2,True,60,5000,2026-07-13,2026-07-16,3,🚀 VIT Pune invites you to participate in Quiz during Vihaan. A perfect platform for competition enthusiasts to demonstrate their talents.,"Competition, Quiz, Highly Reputed, Vihaan, team-event",4.0,4.3,4.2,Highly Reputed,https://vihaan.vit.edu/events/782,events@vihaan.vit.edu,"18.5204° N, 73.8567° E"
783,Web Dev Workshop @ T-Spectra,TSEC Mumbai,T-Spectra,Mumbai,Workshop,Web Dev Workshop,Team,2,2,True,1140,0,2026-09-12,2026-09-14,2,🎯 TSEC Mumbai presents Web Dev Workshop - an exciting workshop event at T-Spectra! Test your skills and compete with the best minds from across Maharashtra.,"Workshop, Web Dev Workshop, Notable, T-Spectra, team-event",3.8,3.7,3.9,Notable,https://tsec.edu.in/t-spectra/events/783,events@tsec.edu.in/t-spectra,"19.0760° N, 72.8777° E"
784,Bot Battle @ Yantra,Ramdeobaba Nagpur,Yantra,Nagpur,Robotics,Bot Battle,Team,2,4,True,1024,20000,2026-07-06,2026-07-07,1,💡 Bot Battle at Yantra - Ramdeobaba Nagpur. Compete in this robotics event and win exciting prizes! Open for all engineering students.,"Robotics, Bot Battle, Notable, Yantra, team-event",4.2,4.1,4.0,Notable,https://rknpec.edu.in/yantra/events/784,events@rknpec.edu.in/yantra,"21.1458° N, 79.0882° E"
785,CAD Design @ FCRIT Fest,FCRIT Navi Mumbai,FCRIT Fest,Navi Mumbai,Mechanical,CAD Design,Solo,1,1,False,1513,50000,2026-05-31,2026-06-01,1,🎯 FCRIT Navi Mumbai presents CAD Design - an exciting mechanical event at FCRIT Fest! Test your skills and compete with the best minds from across Maharashtra.,"Mechanical, CAD Design, Other Notable, FCRIT Fest, solo-event",3.8,3.6,3.7,Other Notable,https://fcrit.ac.in/fest/events/785,events@fcrit.ac.in/fest,"19.0330° N, 73.0297° E"
786,Group Discussion @ Techyon,WCE Sangli,Techyon,Sangli,Competition,Group Discussion,Solo,1,1,False,100,2000,2026-09-30,2026-10-03,3,💡 Group Discussion at Techyon - WCE Sangli. Compete in this competition event and win exciting prizes! Open for all engineering students.,"Competition, Group Discussion, Highly Reputed, Techyon, solo-event",4.6,4.6,4.3,Highly Reputed,https://techyon.wce.ac.in/events/786,events@techyon.wce.ac.in,"16.8637° N, 74.5696° E"
787,Photography @ Bharati Techfest,BVUCOE Pune,Bharati Techfest,Pune,Design,Photography,Solo,1,1,False,340,5000,2026-05-02,2026-05-03,1,🎯 Solo event - Individual participation only. Showcase your personal skills in Design!,"Design, Photography, Notable, Bharati Techfest, solo-event",3.8,4.0,3.9,Notable,https://bvucoepune.edu.in/techfest/events/787,events@bvucoepune.edu.in/techfest,"18.5204° N, 73.8567° E"
788,Quiz @ Techyon,WCE Sangli,Techyon,Sangli,Competition,Quiz,Both,1,3,True,243,2000,2026-07-20,2026-07-22,2,🚀 WCE Sangli invites you to participate in Quiz during Techyon. A perfect platform for competition enthusiasts to demonstrate their talents.,"Competition, Quiz, Highly Reputed, Techyon, team-event",4.5,4.6,4.3,Highly Reputed,https://techyon.wce.ac.in/events/788,events@techyon.wce.ac.in,"16.8637° N, 74.5696° E"
789,Web Dev Workshop @ SFIT Techfest,SFIT Mumbai,SFIT Techfest,Mumbai,Workshop,Web Dev Workshop,Solo,1,1,False,1194,0,2026-09-08,2026-09-09,1,Join us for Web Dev Workshop at SFIT Mumbai's SFIT Techfest! This workshop event challenges participants to showcase their expertise in workshop domain.,"Workshop, Web Dev Workshop, Other Notable, SFIT Techfest, solo-event",4.1,3.7,3.8,Other Notable,https://sfit.ac.in/techfest/events/789,events@sfit.ac.in/techfest,"19.0760° N, 72.8777° E"
790,Surveying @ Vishwaraj,VIIT Pune,Vishwaraj,Pune,Civil,Surveying,Team,3,5,True,1073,10000,2026-08-24,2026-08-27,3,🚀 VIIT Pune invites you to participate in Surveying during Vishwaraj. A perfect platform for civil enthusiasts to demonstrate their talents.,"Civil, Surveying, Notable, Vishwaraj, team-event",3.9,4.3,3.9,Notable,https://viitpune.edu.in/vishwaraj/events/790,events@viitpune.edu.in/vishwaraj,"18.5204° N, 73.8567° E"
